{"contrato": 1, "modeloId": "sac", "modelo": "SAC", "estado": "operando", "simbolo": "BTCUSDT", "posicion": "SHORT", "precio": 63891.5, "equity": 499.94, "saldo": 499.95, "capitalInicial": 500.0, "accion": -0.2344, "operaciones": 0, "ultimaVelaMs": 1785273600000, "enVivo": true, "precioEntrada": 63882.32, "aperturaMs": 1785273600000, "nocional": 117.18, "stopLoss": 64840.56, "takeProfit": 61965.85, "precioLiquidacion": 70015.02, "apalancamiento": 10, "zonaMuerta": 0.1, "motivoRiesgo": null, "comisiones": 0.05, "funding": 0.0, "checkpoint": "mejor", "dineroReal": false, "senales": [{"tiempoMs": 1785273300000, "evento": "abrir_short", "precio": 63882.32098}], "actualizadoMs": 1785273673095}